,PAROLES,Domaine
159,oui mais je parle du marché actuel là,17
160,mais du coup tu vas économiser,17
161,si t’as une répartition très inégale entre si t’as genre dix personnes pour et deux contre là automatiquement t’auras beaucoup plus de chance de tomber sur une personne qu’est pour ,10
162,un peu prise de conscience générale c’est que tu si tu comprends donc si t’as une cul- enfin c’est un peu ça et t’acceptes les choses du coup tu les mets en œuvre enfin ,14
163,bah tu peux emprunter une chemise à ton pote tu vois,8
164,oui et non parce que du coup il ne faut pas qu’ils fassent trois kilomètres pour déposer leurs enfants heu que ça soit galère au niveau de la crèche pour les récupérer enfin,2
165,nan c’est c’est par exemple faut pas penser à c’est faisable ou pas en fait,4
166,si tu veux  orientation plein sud pour les lieux de vie et orientation nord pour les lieux de passage c’est pour ça que les lieux en plein sud en fait ils coûtent plus chers,17
167,bah c’est surtout en fait aussi tu prends que ce que tu que ce dont tu as besoin donc ,15
168,pas avec tout le monde,8
169,pour faire un truc ensemble ou tu vois ou un festival ou un truc,20
170,en fait ça fait des quartiers vraiment habités à certaines heures et le reste totalement mort et ils comparaissaient à Paris où en fait à Paris bah t’as les cafés sont placés de manière vachement enfin heu,18
171,gestion et optimisation ouais voilà moi je vois même pas ça vraiment forcément dans un rapport social avec les autres hein enfin je considère que justement faut établir un système,20
172,ouais c’est quand même tu as le choix,7
173,ce n’est pas tout à fait nucléaire mais c’est le même principe je crois,15
